{
  "$schema": "https://json-schema.org/draft/2020-12/schema",
  "$id": "tracelane://schemas/evidence-registry/v1",
  "title": "TraceLane Evidence Registry",
  "type": "object",
  "additionalProperties": false,
  "required": [
    "schema_id",
    "schema_version",
    "record_sha256",
    "projects"
  ],
  "$defs": {
    "artifact_ref": {
      "type": "object",
      "additionalProperties": false,
      "required": [
        "kind",
        "uri",
        "media_type",
        "sha256",
        "size_bytes"
      ],
      "properties": {
        "kind": {
          "type": "string",
          "pattern": "^[a-z][a-z0-9_]{0,63}$"
        },
        "uri": {
          "type": "string",
          "pattern": "^tracelane://[a-z0-9][a-z0-9._-]*(?:/[a-z0-9][a-z0-9._-]*)*$"
        },
        "media_type": {
          "type": "string",
          "pattern": "^[a-z0-9][a-z0-9.+-]*/[a-z0-9][a-z0-9.+-]*$"
        },
        "sha256": {
          "type": "string",
          "pattern": "^[0-9a-f]{64}$"
        },
        "size_bytes": {
          "type": "integer",
          "minimum": 0
        },
        "schema_id": {
          "type": "string",
          "pattern": "^tracelane://schemas/[a-z0-9][a-z0-9-]*/v[0-9]+$"
        }
      }
    },
    "project_ref": {
      "allOf": [
        {
          "$ref": "#/$defs/artifact_ref"
        },
        {
          "required": [
            "schema_id"
          ],
          "properties": {
            "kind": {
              "const": "evidence_project"
            },
            "uri": {
              "pattern": "^tracelane://evidence/projects/[a-z][a-z0-9-]{2,63}/project\\.json$"
            },
            "media_type": {
              "const": "application/json"
            },
            "schema_id": {
              "const": "tracelane://schemas/evidence-project/v1"
            }
          }
        }
      ]
    },
    "index_ref": {
      "allOf": [
        {
          "$ref": "#/$defs/artifact_ref"
        },
        {
          "required": [
            "schema_id"
          ],
          "properties": {
            "kind": {
              "const": "evidence_project_index"
            },
            "uri": {
              "pattern": "^tracelane://evidence/projects/[a-z][a-z0-9-]{2,63}/index\\.json$"
            },
            "media_type": {
              "const": "application/json"
            },
            "schema_id": {
              "const": "tracelane://schemas/evidence-project-index/v1"
            }
          }
        }
      ]
    },
    "entry": {
      "type": "object",
      "additionalProperties": false,
      "required": [
        "project_id",
        "title",
        "status",
        "project_ref",
        "index_ref"
      ],
      "properties": {
        "project_id": {
          "type": "string",
          "pattern": "^[a-z][a-z0-9-]{2,63}$"
        },
        "title": {
          "type": "string",
          "minLength": 1,
          "pattern": "\\S"
        },
        "status": {
          "enum": [
            "active",
            "paused",
            "completed",
            "archived"
          ]
        },
        "project_ref": {
          "$ref": "#/$defs/project_ref"
        },
        "index_ref": {
          "$ref": "#/$defs/index_ref"
        }
      }
    }
  },
  "properties": {
    "schema_id": {
      "const": "tracelane://schemas/evidence-registry/v1"
    },
    "schema_version": {
      "const": "1.0.0"
    },
    "record_sha256": {
      "type": "string",
      "pattern": "^[0-9a-f]{64}$"
    },
    "projects": {
      "type": "array",
      "uniqueItems": true,
      "items": {
        "$ref": "#/$defs/entry"
      }
    }
  }
}
