{"projects":[{"index_ref":{"kind":"evidence_project_index","media_type":"application/json","schema_id":"tracelane://schemas/evidence-project-index/v1","sha256":"19183edeb49d72b91550591c9cb8fbc7c0e3e73a2e2405e7daaee29b95d0873c","size_bytes":7347,"uri":"tracelane://evidence/projects/hist-001/index.json"},"project_id":"hist-001","project_ref":{"kind":"evidence_project","media_type":"application/json","schema_id":"tracelane://schemas/evidence-project/v1","sha256":"8299fe9624cd1e37667d04bbe4488d5bd4c73d019511f7d9f90a8261c59b1254","size_bytes":696,"uri":"tracelane://evidence/projects/hist-001/project.json"},"status":"active","title":"Napoleon 1812 Counterfactual"}],"record_sha256":"403f26e74985385ca500350ec8ed6fe4bfc7c0b0f66551f48f0df4d58478f683","schema_id":"tracelane://schemas/evidence-registry/v1","schema_version":"1.0.0"}
